{
  "domain": "security",
  "total": 5,
  "timestamp": "2026-08-06T21:21:29.801232+00:00",
  "findings": [
    {
      "severity": "P0",
      "domain": "security",
      "category": "tenancy",
      "file": "apps/api/src/routes/users.ts",
      "endpoint": "GET /api/v1/users, GET /api/v1/users/:id, PATCH /api/v1/users/:id/role, GET /api/v1/users/:id/permissions",
      "data_path": "req.params.id \u2192 supabase.from('users').select() \u2192 all user data",
      "issue": "Users router has no requireOrgAccess \u2014 any authenticated user can access any user's data",
      "exploit_chain": "Authenticated user from Org A calls GET /api/v1/users/:id with Org B user's UUID \u2192 no org membership check \u2192 returns Org B user's email, role, permissions \u2192 cross-tenant user enumeration",
      "impact": "Cross-tenant user enumeration and PII exposure",
      "fix": "Add requireOrgAccess middleware or per-route org membership checks on users router"
    },
    {
      "severity": "P1",
      "domain": "security",
      "category": "tenancy",
      "file": "apps/api/src/routes/search.ts",
      "endpoint": "GET /api/v1/search",
      "data_path": "search query \u2192 supabase.from('*').select() \u2192 cross-org results",
      "issue": "Admin search has no org scope \u2014 returns results across all organizations",
      "exploit_chain": "Admin user with access to Org A calls GET /api/v1/search?q=... \u2192 supabase query returns results from all orgs \u2192 admin sees Org B data they shouldn't",
      "impact": "Cross-org data exposure via search",
      "fix": "Add organization_id filter to search queries or requireOrgAccess middleware"
    },
    {
      "severity": "P1",
      "domain": "security",
      "category": "tenancy",
      "file": "apps/api/src/routes/profiles.ts",
      "endpoint": "GET /api/v1/profiles/:id, PATCH /api/v1/profiles/:id",
      "data_path": "req.params.id \u2192 supabase.from('profiles').select() \u2192 any profile",
      "issue": "Profiles router has no org check \u2014 any authenticated user can access any profile",
      "exploit_chain": "User A enumerates profile UUIDs \u2192 GET /api/v1/profiles/:id for User B \u2192 returns full_name, email, phone, avatar_url \u2192 PII harvesting across orgs",
      "impact": "Cross-tenant PII harvesting (names, emails, phone numbers)",
      "fix": "Add requireOrgAccess or limit profile reads to user's own org members"
    },
    {
      "severity": "P2",
      "domain": "security",
      "category": "validation",
      "file": "apps/api/src/middleware/rate-limit.ts",
      "endpoint": "POST /api/v1/auth/sign-in",
      "data_path": "IP \u2192 rateLimitAuth counter \u2192 10 requests/15min per IP",
      "issue": "Auth rate limit is per-IP only \u2014 attacker can rotate IPs via botnet to brute-force passwords",
      "exploit_chain": "Attacker controls 1000 IP botnet \u2192 each IP gets 10 attempts per 15min \u2192 10,000 password attempts per 15min \u2192 successful brute-force of weak passwords",
      "impact": "Password brute-force via IP rotation",
      "fix": "Add per-email rate limiting (max 5 attempts per email per 15min) in addition to per-IP limit"
    },
    {
      "severity": "P1",
      "domain": "security",
      "category": "exposure",
      "file": "apps/api/src/lib/auth.ts",
      "endpoint": "POST /api/v1/auth/callback (sets mct_session cookie)",
      "data_path": "Set-Cookie: mct_session=<token>; path=/; ...",
      "issue": "Session cookie may lack proper SameSite=Strict and Secure flags \u2014 CSRF token not confirmed",
      "exploit_chain": "Attacker hosts malicious site \u2192 user clicks link while logged into portal \u2192 browser sends mct_session cookie via POST to attacker-controlled endpoint \u2192 session hijack via CSRF if SameSite not set",
      "impact": "CSRF-based session hijack",
      "fix": "Explicitly set cookie with httpOnly=true, secure=true, sameSite='strict', path='/'"
    }
  ]
}