{
  "domain": "ci_cd",
  "total": 1,
  "timestamp": "2026-07-30T06:49:20.870558+00:00",
  "findings": [
    {
      "severity": "P3",
      "domain": "ci_cd",
      "category": "release",
      "file": ".github/workflows/terraform-do.yml",
      "issue": "Prod terraform apply gated by prod-approval environment but no required E2E/test workflow_call dependency before apply",
      "remediation": "Add needs: [validate, e2e] to terraform-apply-prod job",
      "impact": "Terraform changes can be approved and applied even if tests or E2E tests are failing"
    }
  ]
}